{
  "schema_version": "1.0",
  "project": "sample-project",
  "format": "MINI",
  "status": "REVIEW_REQUIRED",
  "timing_grade_default": "ESTIMATED",
  "voice": {
    "audio_file": null,
    "aligned": false,
    "alignment_file": null,
    "total_duration_ms": 9600
  },
  "segments": [
    {
      "beat": 1,
      "shot": "1A",
      "start_ms": 0,
      "end_ms": 4800,
      "timing_grade": "ESTIMATED",
      "source_clip": "clips/shot_1a_flow.mp4",
      "source_duration_ms": 6000,
      "usable_start_ms": 0,
      "usable_end_ms": 5800,
      "key_event_end_ms": 4200,
      "settle_start_ms": 4800,
      "clip_in_ms": 0,
      "clip_out_ms": 4800,
      "camera_behavior": "movement",
      "hold_strategy": "none",
      "hold_ms": 0,
      "trim_reason": null,
      "voice_text": "In 1953, Seoul was mostly rubble.",
      "status": "OK",
      "status_note": null
    },
    {
      "beat": 1,
      "shot": "1B",
      "start_ms": 4800,
      "end_ms": 9600,
      "timing_grade": "ESTIMATED",
      "source_clip": "clips/shot_1b_flow.mp4",
      "source_duration_ms": 6000,
      "usable_start_ms": 0,
      "usable_end_ms": 5600,
      "key_event_end_ms": 3800,
      "settle_start_ms": 4400,
      "clip_in_ms": 200,
      "clip_out_ms": 5000,
      "camera_behavior": "locked-off",
      "hold_strategy": "none",
      "hold_ms": 0,
      "trim_reason": null,
      "voice_text": "",
      "status": "OK",
      "status_note": "Silent continuation of beat 1's narration; no separate voice line for this shot."
    }
  ],
  "overlays": [
    {
      "beat": 1,
      "shot": null,
      "text": "1953",
      "type": "giant_number",
      "start_ms": 0,
      "end_ms": 2400,
      "position_preset": "top-right",
      "position_override": null,
      "source": "stage1_beat_table"
    }
  ],
  "subtitles": [
    {
      "beat": 1,
      "start_ms": 0,
      "end_ms": 4800,
      "lines": ["In 1953, Seoul was mostly rubble."],
      "position_preset": "bottom-center",
      "position_override_reason": null,
      "timing_grade": "ESTIMATED"
    }
  ],
  "audio_layers": {
    "voice": "authoritative",
    "sfx_source": { "mode": "none", "clips": [] },
    "bgm": { "mode": "none", "file": null, "reference_db": null }
  },
  "warnings": [
    {
      "code": "NO_VOICE_ASSET",
      "message": "Voice audio (Stage 4A) has not been generated yet; all timing is ESTIMATED from script word count. Final Render is blocked until Voice is generated (4A) and aligned (4B).",
      "severity": "warning",
      "segment_ref": null
    }
  ]
}
