{
  "schema_version": "1.0",
  "project": "fixture-valid-minimal",
  "format": "MINI",
  "status": "READY",
  "timing_grade_default": "EXACT",
  "voice": {
    "audio_file": "clips/audio/voice_final.wav",
    "aligned": true,
    "alignment_file": "clips/audio/voice_alignment.json",
    "total_duration_ms": 9600
  },
  "segments": [
    {
      "beat": 1,
      "shot": "1A",
      "start_ms": 0,
      "end_ms": 4800,
      "timing_grade": "EXACT",
      "source_clip": "clips/shot_1a_flow.mp4",
      "source_duration_ms": 6000,
      "usable_start_ms": 0,
      "usable_end_ms": 5800,
      "key_event_end_ms": 4200,
      "settle_start_ms": 4800,
      "clip_in_ms": 0,
      "clip_out_ms": 4800,
      "camera_behavior": "movement",
      "hold_strategy": "none",
      "hold_ms": 0,
      "trim_reason": null,
      "voice_text": "In 1953, Seoul was mostly rubble.",
      "status": "OK",
      "status_note": null
    },
    {
      "beat": 1,
      "shot": "1B",
      "start_ms": 4800,
      "end_ms": 9600,
      "timing_grade": "EXACT",
      "source_clip": "clips/shot_1b_flow.mp4",
      "source_duration_ms": 6000,
      "usable_start_ms": 0,
      "usable_end_ms": 5600,
      "key_event_end_ms": 3800,
      "settle_start_ms": 4400,
      "clip_in_ms": 200,
      "clip_out_ms": 5000,
      "camera_behavior": "locked-off",
      "hold_strategy": "none",
      "hold_ms": 0,
      "trim_reason": null,
      "voice_text": "To understand what happened next, look at the tariff tables.",
      "status": "OK",
      "status_note": null
    }
  ],
  "overlays": [
    {
      "beat": 1,
      "shot": null,
      "text": "1953",
      "type": "giant_number",
      "start_ms": 0,
      "end_ms": 2400,
      "position_preset": "top-right",
      "position_override": null,
      "source": "stage1_beat_table"
    }
  ],
  "subtitles": [
    {
      "beat": 1,
      "start_ms": 0,
      "end_ms": 4800,
      "lines": ["In 1953, Seoul was mostly rubble."],
      "position_preset": "bottom-center",
      "position_override_reason": null,
      "timing_grade": "EXACT"
    }
  ],
  "audio_layers": {
    "voice": "authoritative",
    "sfx_source": {
      "mode": "stage3_optional",
      "clips": [
        { "shot": "1A", "file": "clips/audio/sfx/shot_1a_source.wav", "action": "adopted" }
      ]
    },
    "bgm": {
      "mode": "selected",
      "file": "clips/audio/bgm/bgm_01.mp3",
      "reference_db": -18.0
    }
  },
  "warnings": []
}
